{
  "schemaVersion": "1.0.0",
  "sourceId": "dambrisi-2015",
  "recordStatus": "requires-full-text",
  "citation": {
    "authors": [
      "Angelo D'Ambrisi",
      "Francesco Focacci",
      "Raimondo Luciano",
      "Valerio Alecci",
      "Mario De Stefano"
    ],
    "year": 2015,
    "title": "Carbon-FRCM materials for structural upgrade of masonry arch road bridges",
    "container": "Composites Part B: Engineering",
    "volume": "75",
    "pages": "355-366",
    "doi": "10.1016/j.compositesb.2015.01.024",
    "publisher": "Elsevier",
    "language": "English"
  },
  "document": {
    "kind": "analytical",
    "fullTextAccess": "closed",
    "fullTextUrl": null,
    "fullTextVersion": null,
    "accessNote": "Repository records (UniFi Flore hdl.handle.net/2158/1009756, UniParthenope hdl.handle.net/11367/72573) carry the published PDF under restricted access.",
    "license": null
  },
  "abstract": "In the present paper the design criteria for strengthening masonry bridges with carbon fiber reinforced cementitious matrix (C-FRCM) materials are presented with reference to a masonry arch road bridge built right after the second world war.",
  "specimens": [],
  "extractionNotes": [
    "Abstract retrieved from the UniFi Flore record on 2026-08-16.",
    "Full text required for the case-study bridge geometry and design calculations.",
    "Provisional tier: C (design-oriented case study, not a laboratory benchmark)."
  ]
}
